{"schema_version":1,"protocol":{"version":"1.0.0","sha256":"a781d1cd6a2421966a75aac034c2d93546bf793829ebf34be095786b488054d3"},"record_id":"SR-SYNTH001","synthetic":true,"availability":"unavailable","unavailable_reason":"Fictional unavailable combination for validator coverage only.","reviewed_at":null,"reviewer_code":"REV-SYNTH","privacy_reviewed":true,"retention":{"policy_version":"test-only","delete_after":"2030-01-02"},"environment":{"os":{"name":"Windows","version":"11.0+24H2"},"assistive_technology":{"name":"NVDA","version":"2026.1"},"browser":{"name":"Firefox","version":"142.0"},"report_build":"a0082e2e778d3302c3a453d1b67138a8396b7687e4ffee723c5a1dd2d726bbf5"},"tasks":[],"findings":[]}
